{
  "$schema": "https://json-schema.org/draft/2020-12/schema",
  "title": "CoverageSummary",
  "description": "The three independent coverage dimensions and outcome comparison.",
  "type": "object",
  "properties": {
    "execution": {
      "$ref": "#/$defs/ComputedCoverage2"
    },
    "outcome": {
      "$ref": "#/$defs/ComputedCoverage3"
    },
    "outcome_comparison": {
      "anyOf": [
        {
          "$ref": "#/$defs/OutcomeComparisonState"
        },
        {
          "type": "null"
        }
      ]
    },
    "schema_version": {
      "$ref": "#/$defs/SchemaVersion"
    },
    "semantic": {
      "$ref": "#/$defs/ComputedCoverage"
    }
  },
  "additionalProperties": false,
  "required": [
    "schema_version",
    "semantic",
    "execution",
    "outcome"
  ],
  "$defs": {
    "ComputedCoverage": {
      "description": "One versioned, server-derived coverage dimension.",
      "type": "object",
      "properties": {
        "computation_version": {
          "type": "string"
        },
        "contributing_source_refs": {
          "type": "array",
          "items": {
            "$ref": "#/$defs/SourceId"
          }
        },
        "coverage_gap_refs": {
          "type": "array",
          "items": {
            "type": "string"
          }
        },
        "evidence_refs": {
          "type": "array",
          "items": {
            "type": "string"
          }
        },
        "input_watermark": {
          "type": "integer",
          "format": "uint64",
          "minimum": 0
        },
        "projection_revision": {
          "type": "integer",
          "format": "uint64",
          "minimum": 1
        },
        "reason_codes": {
          "type": "array",
          "items": {
            "$ref": "#/$defs/CoverageReasonCode"
          },
          "minItems": 1
        },
        "state": {
          "$ref": "#/$defs/SemanticCoverageState"
        }
      },
      "additionalProperties": false,
      "required": [
        "state",
        "computation_version",
        "projection_revision",
        "input_watermark",
        "reason_codes",
        "evidence_refs",
        "contributing_source_refs",
        "coverage_gap_refs"
      ]
    },
    "ComputedCoverage2": {
      "description": "One versioned, server-derived coverage dimension.",
      "type": "object",
      "properties": {
        "computation_version": {
          "type": "string"
        },
        "contributing_source_refs": {
          "type": "array",
          "items": {
            "$ref": "#/$defs/SourceId"
          }
        },
        "coverage_gap_refs": {
          "type": "array",
          "items": {
            "type": "string"
          }
        },
        "evidence_refs": {
          "type": "array",
          "items": {
            "type": "string"
          }
        },
        "input_watermark": {
          "type": "integer",
          "format": "uint64",
          "minimum": 0
        },
        "projection_revision": {
          "type": "integer",
          "format": "uint64",
          "minimum": 1
        },
        "reason_codes": {
          "type": "array",
          "items": {
            "$ref": "#/$defs/CoverageReasonCode"
          },
          "minItems": 1
        },
        "state": {
          "$ref": "#/$defs/ExecutionCoverageState"
        }
      },
      "additionalProperties": false,
      "required": [
        "state",
        "computation_version",
        "projection_revision",
        "input_watermark",
        "reason_codes",
        "evidence_refs",
        "contributing_source_refs",
        "coverage_gap_refs"
      ]
    },
    "ComputedCoverage3": {
      "description": "One versioned, server-derived coverage dimension.",
      "type": "object",
      "properties": {
        "computation_version": {
          "type": "string"
        },
        "contributing_source_refs": {
          "type": "array",
          "items": {
            "$ref": "#/$defs/SourceId"
          }
        },
        "coverage_gap_refs": {
          "type": "array",
          "items": {
            "type": "string"
          }
        },
        "evidence_refs": {
          "type": "array",
          "items": {
            "type": "string"
          }
        },
        "input_watermark": {
          "type": "integer",
          "format": "uint64",
          "minimum": 0
        },
        "projection_revision": {
          "type": "integer",
          "format": "uint64",
          "minimum": 1
        },
        "reason_codes": {
          "type": "array",
          "items": {
            "$ref": "#/$defs/CoverageReasonCode"
          },
          "minItems": 1
        },
        "state": {
          "$ref": "#/$defs/OutcomeCoverageState"
        }
      },
      "additionalProperties": false,
      "required": [
        "state",
        "computation_version",
        "projection_revision",
        "input_watermark",
        "reason_codes",
        "evidence_refs",
        "contributing_source_refs",
        "coverage_gap_refs"
      ]
    },
    "CoverageReasonCode": {
      "description": "Stable reasons attached to a coverage computation.",
      "oneOf": [
        {
          "description": "All requirements for the dimension were met.",
          "type": "string",
          "const": "requirements_satisfied"
        },
        {
          "description": "A required source or lifecycle item is absent.",
          "type": "string",
          "const": "required_evidence_missing"
        },
        {
          "description": "A source reported dropped evidence.",
          "type": "string",
          "const": "source_loss"
        },
        {
          "description": "The source samples rather than observing every qualifying item.",
          "type": "string",
          "const": "sampling_enabled"
        },
        {
          "description": "The source truncated evidence.",
          "type": "string",
          "const": "evidence_truncated"
        },
        {
          "description": "A required source failed.",
          "type": "string",
          "const": "source_failed"
        },
        {
          "description": "The environment does not expose the required capability.",
          "type": "string",
          "const": "unsupported_capability"
        },
        {
          "description": "The relevant environment boundary is opaque.",
          "type": "string",
          "const": "opaque_boundary"
        },
        {
          "description": "No independent outcome verifier contributed.",
          "type": "string",
          "const": "verifier_missing"
        },
        {
          "description": "An independent check disagrees with a claim.",
          "type": "string",
          "const": "outcome_mismatch"
        },
        {
          "description": "This dimension has no requirement for the run profile.",
          "type": "string",
          "const": "no_applicable_requirement"
        },
        {
          "description": "Available evidence does not support a stronger state.",
          "type": "string",
          "const": "insufficient_evidence"
        }
      ]
    },
    "ExecutionCoverageState": {
      "description": "Server-derived Execution Coverage states.",
      "oneOf": [
        {
          "description": "The controlled host boundary met its declared capability without a gap.",
          "type": "string",
          "const": "host_verified"
        },
        {
          "description": "Execution evidence exists with a known capability or loss gap.",
          "type": "string",
          "const": "partial"
        },
        {
          "description": "No qualifying source can observe the execution boundary.",
          "type": "string",
          "const": "opaque"
        },
        {
          "description": "The run profile requires no execution assertion.",
          "type": "string",
          "const": "not_applicable"
        },
        {
          "description": "A required execution source did not produce usable complete evidence.",
          "type": "string",
          "const": "incomplete"
        }
      ]
    },
    "OutcomeComparisonState": {
      "description": "Comparison between a claim and an independent outcome check.",
      "oneOf": [
        {
          "description": "The independent check matches the claimed outcome.",
          "type": "string",
          "const": "match"
        },
        {
          "description": "The independent check disagrees with the claimed outcome.",
          "type": "string",
          "const": "mismatch"
        },
        {
          "description": "A definitive comparison is not currently available.",
          "type": "string",
          "const": "unresolved"
        }
      ]
    },
    "OutcomeCoverageState": {
      "description": "Server-derived Outcome Coverage states.",
      "oneOf": [
        {
          "description": "A required outcome was independently checked, whether matching or not.",
          "type": "string",
          "const": "verified"
        },
        {
          "description": "An outcome was claimed but not independently checked.",
          "type": "string",
          "const": "unconfirmed"
        },
        {
          "description": "A reliable claim/check relationship cannot be established.",
          "type": "string",
          "const": "unknown"
        },
        {
          "description": "The run profile requires no external outcome.",
          "type": "string",
          "const": "not_applicable"
        }
      ]
    },
    "SchemaVersion": {
      "description": "Wire schema versions understood by this crate.",
      "oneOf": [
        {
          "description": "Agent Execution Record schema v0.1.",
          "type": "string",
          "const": "0.1"
        }
      ]
    },
    "SemanticCoverageState": {
      "description": "Server-derived Semantic Coverage states.",
      "oneOf": [
        {
          "description": "All required semantic lifecycle evidence was observed.",
          "type": "string",
          "const": "complete"
        },
        {
          "description": "Useful semantic evidence exists with a known required gap.",
          "type": "string",
          "const": "partial"
        },
        {
          "description": "The semantic boundary is intentionally opaque.",
          "type": "string",
          "const": "opaque"
        },
        {
          "description": "Expected semantic evidence is not usable or available.",
          "type": "string",
          "const": "unavailable"
        }
      ]
    },
    "SourceId": {
      "description": "A registered Evidence Source identifier.",
      "type": "string",
      "maxLength": 128,
      "minLength": 1,
      "pattern": "^[A-Za-z0-9](?:[A-Za-z0-9._:-]{0,126}[A-Za-z0-9])?$"
    }
  }
}
