[
  {
    "schema_version": "0.1",
    "semantic": {"state": "complete", "computation_version": "coverage_v1", "projection_revision": 1, "input_watermark": 12, "reason_codes": ["requirements_satisfied"], "evidence_refs": ["evidence_semantic_01"], "contributing_source_refs": ["source_semantic"], "coverage_gap_refs": []},
    "execution": {"state": "host_verified", "computation_version": "coverage_v1", "projection_revision": 1, "input_watermark": 12, "reason_codes": ["requirements_satisfied"], "evidence_refs": ["evidence_runtime_01"], "contributing_source_refs": [], "coverage_gap_refs": []},
    "outcome": {"state": "verified", "computation_version": "coverage_v1", "projection_revision": 1, "input_watermark": 12, "reason_codes": ["requirements_satisfied"], "evidence_refs": ["evidence_outcome_01"], "contributing_source_refs": [], "coverage_gap_refs": []},
    "outcome_comparison": "match"
  },
  {
    "schema_version": "0.1",
    "semantic": {"state": "partial", "computation_version": "coverage_v1", "projection_revision": 2, "input_watermark": 20, "reason_codes": ["required_evidence_missing"], "evidence_refs": [], "contributing_source_refs": ["source_semantic"], "coverage_gap_refs": ["gap_semantic_missing"]},
    "execution": {"state": "partial", "computation_version": "coverage_v1", "projection_revision": 2, "input_watermark": 20, "reason_codes": ["sampling_enabled"], "evidence_refs": ["evidence_runtime_02"], "contributing_source_refs": [], "coverage_gap_refs": []},
    "outcome": {"state": "unconfirmed", "computation_version": "coverage_v1", "projection_revision": 2, "input_watermark": 20, "reason_codes": ["verifier_missing"], "evidence_refs": ["evidence_claim_02"], "contributing_source_refs": [], "coverage_gap_refs": []},
    "outcome_comparison": "unresolved"
  },
  {
    "schema_version": "0.1",
    "semantic": {"state": "opaque", "computation_version": "coverage_v1", "projection_revision": 3, "input_watermark": 30, "reason_codes": ["opaque_boundary"], "evidence_refs": [], "contributing_source_refs": [], "coverage_gap_refs": []},
    "execution": {"state": "opaque", "computation_version": "coverage_v1", "projection_revision": 3, "input_watermark": 30, "reason_codes": ["opaque_boundary"], "evidence_refs": [], "contributing_source_refs": [], "coverage_gap_refs": []},
    "outcome": {"state": "unknown", "computation_version": "coverage_v1", "projection_revision": 3, "input_watermark": 30, "reason_codes": ["insufficient_evidence"], "evidence_refs": [], "contributing_source_refs": [], "coverage_gap_refs": []},
    "outcome_comparison": "unresolved"
  },
  {
    "schema_version": "0.1",
    "semantic": {"state": "unavailable", "computation_version": "coverage_v1", "projection_revision": 4, "input_watermark": 40, "reason_codes": ["source_failed"], "evidence_refs": [], "contributing_source_refs": [], "coverage_gap_refs": []},
    "execution": {"state": "incomplete", "computation_version": "coverage_v1", "projection_revision": 4, "input_watermark": 40, "reason_codes": ["source_loss"], "evidence_refs": ["evidence_gap_04"], "contributing_source_refs": [], "coverage_gap_refs": []},
    "outcome": {"state": "verified", "computation_version": "coverage_v1", "projection_revision": 4, "input_watermark": 40, "reason_codes": ["outcome_mismatch"], "evidence_refs": ["evidence_claim_04", "evidence_readback_04"], "contributing_source_refs": [], "coverage_gap_refs": []},
    "outcome_comparison": "mismatch"
  },
  {
    "schema_version": "0.1",
    "semantic": {"state": "complete", "computation_version": "coverage_v1", "projection_revision": 5, "input_watermark": 50, "reason_codes": ["requirements_satisfied"], "evidence_refs": ["evidence_semantic_05"], "contributing_source_refs": [], "coverage_gap_refs": []},
    "execution": {"state": "not_applicable", "computation_version": "coverage_v1", "projection_revision": 5, "input_watermark": 50, "reason_codes": ["no_applicable_requirement"], "evidence_refs": [], "contributing_source_refs": [], "coverage_gap_refs": []},
    "outcome": {"state": "not_applicable", "computation_version": "coverage_v1", "projection_revision": 5, "input_watermark": 50, "reason_codes": ["no_applicable_requirement"], "evidence_refs": [], "contributing_source_refs": [], "coverage_gap_refs": []},
    "outcome_comparison": null
  }
]
